{
  "amendment_id": "s4_4_data_expansion_amendment_02",
  "calendar_day_role": "distinct_day_3",
  "manifest_sha256": "e2ce67f1d9a49750fff7f5cddea655998d4b3d56c48a18c6809574b788c48f2e",
  "partition": "prospective_holdout",
  "planned_take_count": 47,
  "schema": "ias.s4_4.data_expansion_manifest.v2",
  "session_date_local": null,
  "session_id": "prospective_holdout",
  "status": "frozen_before_collection",
  "takes": [
    {
      "category": "silence",
      "complete_removal_and_fresh_reposition_required": false,
      "duration_s": 15,
      "expected_artifact_paths": {
        "attempt_01_manifest": "dataset/S4.4/amendments/s4_4_data_expansion_amendment_02/attempts/s44a02_prospective_holdout_001_sil/s44a02_prospective_holdout_001_sil__attempt_01/manifest.json",
        "attempt_01_root": "dataset/S4.4/amendments/s4_4_data_expansion_amendment_02/attempts/s44a02_prospective_holdout_001_sil/s44a02_prospective_holdout_001_sil__attempt_01",
        "planned_cell_record": "dataset/S4.4/amendments/s4_4_data_expansion_amendment_02/attempts/s44a02_prospective_holdout_001_sil/planned_cell.json",
        "replacement_attempt_02_manifest": "dataset/S4.4/amendments/s4_4_data_expansion_amendment_02/attempts/s44a02_prospective_holdout_001_sil/s44a02_prospective_holdout_001_sil__attempt_02/manifest.json",
        "replacement_attempt_02_root": "dataset/S4.4/amendments/s4_4_data_expansion_amendment_02/attempts/s44a02_prospective_holdout_001_sil/s44a02_prospective_holdout_001_sil__attempt_02"
      },
      "group_id": "s44a02_grp_163388fbb42d2f3d8a11",
      "group_identity": {
        "acoustic_condition": "ambient_silence",
        "mounting_condition": "S4_TEMP_DESKTOP_FIXTURE_REV0",
        "room_id": "WANG_2022_DESK_NEAR_ENTRANCE",
        "session_id": "prospective_holdout",
        "source_device": "not_applicable",
        "source_identity": "ambient_room_silence",
        "source_type": "silence",
        "target_bearing_deg_f_project": null,
        "target_position_m_f_project": null,
        "target_radius_m": null
      },
      "modality_bundle": [
        "six_channel_audio"
      ],
      "partition": "prospective_holdout",
      "planned_take_id": "s44a02_prospective_holdout_001_sil",
      "playback_gain": null,
      "predecessor_planned_take_id": null,
      "recorded_position_bearing_distance_required": false,
      "repetition": 1,
      "sequence_index": 1,
      "session_date_local": null,
      "session_id": "prospective_holdout",
      "silence_slot": "beginning",
      "source_device": "not_applicable",
      "source_frame": "F_project",
      "source_identity": "ambient_room_silence",
      "source_type": "silence",
      "successor_planned_take_id": "s44a02_prospective_holdout_002_ctl",
      "sweep_direction": null,
      "sweep_index": null,
      "take_definition_sha256": "19bfb64cde21f91e43e644aa2376bdad221c30183bd18f2c71493589cace9cbf",
      "target_bearing_deg_f_project": null,
      "target_position_m_f_project": null,
      "target_radius_m": null,
      "zed_required": false
    },
    {
      "category": "controlled",
      "complete_removal_and_fresh_reposition_required": true,
      "duration_s": 20,
      "expected_artifact_paths": {
        "attempt_01_manifest": "dataset/S4.4/amendments/s4_4_data_expansion_amendment_02/attempts/s44a02_prospective_holdout_002_ctl/s44a02_prospective_holdout_002_ctl__attempt_01/manifest.json",
        "attempt_01_root": "dataset/S4.4/amendments/s4_4_data_expansion_amendment_02/attempts/s44a02_prospective_holdout_002_ctl/s44a02_prospective_holdout_002_ctl__attempt_01",
        "planned_cell_record": "dataset/S4.4/amendments/s4_4_data_expansion_amendment_02/attempts/s44a02_prospective_holdout_002_ctl/planned_cell.json",
        "replacement_attempt_02_manifest": "dataset/S4.4/amendments/s4_4_data_expansion_amendment_02/attempts/s44a02_prospective_holdout_002_ctl/s44a02_prospective_holdout_002_ctl__attempt_02/manifest.json",
        "replacement_attempt_02_root": "dataset/S4.4/amendments/s4_4_data_expansion_amendment_02/attempts/s44a02_prospective_holdout_002_ctl/s44a02_prospective_holdout_002_ctl__attempt_02"
      },
      "group_id": "s44a02_grp_214227e66c771868dc0a",
      "group_identity": {
        "acoustic_condition": "unobstructed_reference",
        "mounting_condition": "S4_TEMP_DESKTOP_FIXTURE_REV0",
        "room_id": "WANG_2022_DESK_NEAR_ENTRANCE",
        "session_id": "prospective_holdout",
        "source_device": "MacBookPro18,1 built-in speakers",
        "source_identity": "27929826ae179faf5adb1aa2759ed302a0cd6163b3ec8324325e7cdf0b143468",
        "source_type": "reference_wav",
        "target_bearing_deg_f_project": 22.5,
        "target_position_m_f_project": [
          0.739104,
          0.306147,
          -0.135
        ],
        "target_radius_m": 0.8
      },
      "mac_keyboard_plane": "level",
      "mac_lid_angle_deg": 90,
      "mac_system_volume_percent": 40,
      "modality_bundle": [
        "six_channel_audio"
      ],
      "partition": "prospective_holdout",
      "planned_take_id": "s44a02_prospective_holdout_002_ctl",
      "playback_gain": 0.75,
      "predecessor_planned_take_id": "s44a02_prospective_holdout_001_sil",
      "recorded_position_bearing_distance_required": true,
      "repetition": 1,
      "sequence_index": 2,
      "session_date_local": null,
      "session_id": "prospective_holdout",
      "silence_slot": null,
      "source_device": "MacBookPro18,1 built-in speakers",
      "source_frame": "F_project",
      "source_identity": "27929826ae179faf5adb1aa2759ed302a0cd6163b3ec8324325e7cdf0b143468",
      "source_orientation": "speaker_midpoint_radially_toward_microphone_rig",
      "source_type": "reference_wav",
      "successor_planned_take_id": "s44a02_prospective_holdout_003_ctl",
      "sweep_direction": "clockwise",
      "sweep_index": 1,
      "take_definition_sha256": "9f3d5b53a8e7c8b61639513e82f578b17244031511ec09e1f2e7d1001ad3e004",
      "target_bearing_deg_f_project": 22.5,
      "target_position_m_f_project": [
        0.739104,
        0.306147,
        -0.135
      ],
      "target_radius_m": 0.8,
      "zed_required": false
    },
    {
      "category": "controlled",
      "complete_removal_and_fresh_reposition_required": true,
      "duration_s": 20,
      "expected_artifact_paths": {
        "attempt_01_manifest": "dataset/S4.4/amendments/s4_4_data_expansion_amendment_02/attempts/s44a02_prospective_holdout_003_ctl/s44a02_prospective_holdout_003_ctl__attempt_01/manifest.json",
        "attempt_01_root": "dataset/S4.4/amendments/s4_4_data_expansion_amendment_02/attempts/s44a02_prospective_holdout_003_ctl/s44a02_prospective_holdout_003_ctl__attempt_01",
        "planned_cell_record": "dataset/S4.4/amendments/s4_4_data_expansion_amendment_02/attempts/s44a02_prospective_holdout_003_ctl/planned_cell.json",
        "replacement_attempt_02_manifest": "dataset/S4.4/amendments/s4_4_data_expansion_amendment_02/attempts/s44a02_prospective_holdout_003_ctl/s44a02_prospective_holdout_003_ctl__attempt_02/manifest.json",
        "replacement_attempt_02_root": "dataset/S4.4/amendments/s4_4_data_expansion_amendment_02/attempts/s44a02_prospective_holdout_003_ctl/s44a02_prospective_holdout_003_ctl__attempt_02"
      },
      "group_id": "s44a02_grp_da39807b70c4b4cdbbb1",
      "group_identity": {
        "acoustic_condition": "unobstructed_reference",
        "mounting_condition": "S4_TEMP_DESKTOP_FIXTURE_REV0",
        "room_id": "WANG_2022_DESK_NEAR_ENTRANCE",
        "session_id": "prospective_holdout",
        "source_device": "MacBookPro18,1 built-in speakers",
        "source_identity": "27929826ae179faf5adb1aa2759ed302a0cd6163b3ec8324325e7cdf0b143468",
        "source_type": "reference_wav",
        "target_bearing_deg_f_project": 67.5,
        "target_position_m_f_project": [
          0.306147,
          0.739104,
          -0.135
        ],
        "target_radius_m": 0.8
      },
      "mac_keyboard_plane": "level",
      "mac_lid_angle_deg": 90,
      "mac_system_volume_percent": 40,
      "modality_bundle": [
        "six_channel_audio"
      ],
      "partition": "prospective_holdout",
      "planned_take_id": "s44a02_prospective_holdout_003_ctl",
      "playback_gain": 0.75,
      "predecessor_planned_take_id": "s44a02_prospective_holdout_002_ctl",
      "recorded_position_bearing_distance_required": true,
      "repetition": 1,
      "sequence_index": 3,
      "session_date_local": null,
      "session_id": "prospective_holdout",
      "silence_slot": null,
      "source_device": "MacBookPro18,1 built-in speakers",
      "source_frame": "F_project",
      "source_identity": "27929826ae179faf5adb1aa2759ed302a0cd6163b3ec8324325e7cdf0b143468",
      "source_orientation": "speaker_midpoint_radially_toward_microphone_rig",
      "source_type": "reference_wav",
      "successor_planned_take_id": "s44a02_prospective_holdout_004_ctl",
      "sweep_direction": "clockwise",
      "sweep_index": 1,
      "take_definition_sha256": "ddd0c6835af27016053335a4e949da835c7c3dfee22cfb2ac927cf11d307958a",
      "target_bearing_deg_f_project": 67.5,
      "target_position_m_f_project": [
        0.306147,
        0.739104,
        -0.135
      ],
      "target_radius_m": 0.8,
      "zed_required": false
    },
    {
      "category": "controlled",
      "complete_removal_and_fresh_reposition_required": true,
      "duration_s": 20,
      "expected_artifact_paths": {
        "attempt_01_manifest": "dataset/S4.4/amendments/s4_4_data_expansion_amendment_02/attempts/s44a02_prospective_holdout_004_ctl/s44a02_prospective_holdout_004_ctl__attempt_01/manifest.json",
        "attempt_01_root": "dataset/S4.4/amendments/s4_4_data_expansion_amendment_02/attempts/s44a02_prospective_holdout_004_ctl/s44a02_prospective_holdout_004_ctl__attempt_01",
        "planned_cell_record": "dataset/S4.4/amendments/s4_4_data_expansion_amendment_02/attempts/s44a02_prospective_holdout_004_ctl/planned_cell.json",